{
  "$schema": "https://json-schema.org/draft/2020-12/schema",
  "type": "object",
  "required": ["id", "title", "description"],
  "properties": {
    "id": {"type": "string"},
    "title": {"type": "string"},
    "description": {"type": "string"},
    "context": {"type": "object", "additionalProperties": {"type": "string"}},
    "constraints": {"type": "array", "items": {"type": "string"}}
  },
  "additionalProperties": false
}


