{
  "id": "sc_ai_commerce_insight",
  "title": "상품 검색 및 커머스 경험 솔직 인사이트 리서치",
  "description": "상품 검색과 커머스 경험을 스스로 떠올리며, 실제 겪은 사례를 바탕으로 진실되게 설문에 응답해주세요.",
  "context": {
    "platform": "web",
    "region": "KR",
    "purpose": "서비스개발전, 진정성 있는 사용자 목소리 수집"
  },
  "constraints": [
    "답변 분량은 최대 120단어",
    "본인의 실제 경험을 바탕으로 작성",
    "구체적인 사례나 장면을 반드시 포함"
  ]
}
